{
  "jsonrpc": "2.0",
  "id": "sampleid",
  "error": {
    "type": "parsingerror",
    "code": 400,
    "errorPrint": "The request could not be read by our software.",
    "message": "Parsing error"
  },
  "debug": {
    "cause": {
      "error": {
        "code": 400,
        "message": "One of the properties contained illegal characters",
        "errorPrint": "One of the values provided has invalid characters",
        "type": "parsingerror"
      },
      "id": "sampleid",
      "debug": {
        "stackInfo": [
          "Callnumber1",
          "Callnumber2"
        ]
      }
    }
  }
}